{
  "$schema": "https://json-schema.org/draft/2020-12/schema",
  "$id": "https://example.invalid/schemas/period-report.schema.json",
  "title": "Persönlicher Lagebericht – Zeitraumbericht",
  "type": "object",
  "additionalProperties": false,
  "required": ["schemaVersion", "periodType", "periodStart", "periodEnd", "generatedAt", "status", "overallSummary", "countries", "sourceReportDates", "missingReportDates"],
  "properties": {
    "schemaVersion": {"const": 1},
    "periodType": {"enum": ["week", "month"]},
    "periodStart": {"type": "string", "format": "date"},
    "periodEnd": {"type": "string", "format": "date"},
    "generatedAt": {"type": "string", "format": "date-time"},
    "status": {"enum": ["complete", "partial"]},
    "overallSummary": {"type": "array", "minItems": 1, "maxItems": 8, "items": {"type": "string", "minLength": 1, "maxLength": 500}},
    "countries": {"type": "array", "minItems": 3, "maxItems": 3},
    "sourceReportDates": {"type": "array", "uniqueItems": true, "items": {"type": "string", "format": "date"}},
    "missingReportDates": {"type": "array", "uniqueItems": true, "items": {"type": "string", "format": "date"}}
  }
}
